{"schema_version":"1.0.0","course_id":"TDE_9","theme_id":"TEMA_03","block_id":"BLOCK_T3_01_OKUMA","lesson_hours":2,"plan_title":"Bizim Akdeniz’den’de Anlam ve Tür: Bilgi, Gözlem, İleti ve Gezi Yazısı İşlevi","plan_summary":"15 saatlik 3. Tema Okuma bloğunun 11. ve 12. ders saatlerinde öğrenciler T3_ACT_06_OKUMA_SONRASI_GEZI_TAHLIL kapsamında Falih Rıfkı Atay’ın ‘Bizim Akdeniz’den’ metninde P05’te ayırt ettikleri bilgi, gözlem ve betimleme göstergelerini anlam katmanına dönüştürür. İlk saatte bağlamdan söz varlığı, doğrudan bilgi, yazar gözlemi ve açık/örtük iletiler kanıtla ayrıştırılır. İkinci saatte bu bulgular gezi yazısının öğretici yönü ve tür işleviyle ilişkilendirilir; yazarın bir mekânı yalnız tanıtmakla kalmayıp seçtiği ayrıntılarla okura bir bakış açısı sunduğu gösterilir. Mekânsal yapı, anlatım düzeni ve belirteç çalışması P07’ye bırakılır.","outcome_codes":["TDE2.2","TDE2.3"],"used_activity_ids":["T3_ACT_06_OKUMA_SONRASI_GEZI_TAHLIL"],"used_form_ids":[],"lessons":[{"lesson_no":1,"duration_lesson_hours":1,"title":"Söz varlığı, bilgi, gözlem ve açık-örtük iletiyi kanıtla ayırma","objective":"Öğrencinin ‘Bizim Akdeniz’den’ metnindeki söz varlığını bağlamdan anlamlandırması; doğrudan bilgi, yazar gözlemi ve açık/örtük iletileri metin göstergeleriyle birbirinden ayırarak gerekçelendirmesi.","outcome_codes":["TDE2.2"],"opening":"P05’te oluşturulan ‘açık bilgi / yazar gözlemi / betimleme / kendi çıkarımım’ tablosu açılır. ‘Bir gezi yazısında yazarın gördüğünü söylemesi ile okura bir düşünce sezdirmesi aynı şey midir?’ sorusuyla anlam katmanları ayrıştırılır.","teacher_actions":["T3_ACT_06_OKUMA_SONRASI_GEZI_TAHLIL’i temel al; P05’te işaretlenen örnekleri yeniden kullanarak yeni ve kaynak dışı metin bilgisi ekleme.","Bilinmeyen veya anlamı bağlama göre değişen sözlerde öğrenciden ‘söz → bağlam ipucu → olası anlam → cümledeki işlev’ zinciri kurmasını iste.","Doğrudan bilgi ile yazar gözlemini ayır: ilkinde metinde açıkça verilen veriyi, ikincisinde yazarın seçtiği/gördüğü ayrıntıyı ve buna eşlik eden bakışı göster.","Örtük ileti için tek sözcükten sonuç çıkarmak yerine en az iki metin göstergesi arat; ‘gösterge → çıkarım → gerekçe’ zincirini görünür kıl.","Öğrencinin kişisel değerlendirmesini metnin açık bilgisi gibi sunmasını engelle; ‘metnin söylediği / yazarın gözlemi / benim çıkarımım’ ayrımını koru."],"student_actions":["P05’te bağlamdan anlamlandırdığı sözleri yeniden kontrol eder ve en az birini bağlam ipucuyla açıklar.","Bir doğrudan bilgi ve bir yazar gözlemini metinden seçip neden farklı olduklarını açıklar.","En az bir açık iletiyi metin göstergesiyle belirtir.","En az bir örtük iletiyi iki metin göstergesiyle gerekçelendirir.","Kendi yorumunu metinde doğrudan verilen bilgi ve yazar gözleminden ayrı biçimde kaydeder."],"activity_ids":["T3_ACT_06_OKUMA_SONRASI_GEZI_TAHLIL"],"form_ids":[],"assessment":"Ana ürün dört sütunlu kısa anlam kaydıdır: ‘metin göstergesi → açık bilgi/yazar gözlemi/örtük ileti → söz varlığı-bağlam ilişkisi → gerekçeli yorum’. Örtük yorumlarda en az iki kanıt aranır.","closure":"Öğrenci ‘Metin açıkça … bilgisini veriyor; yazarın … gözlemi ise … düşüncesini sezdiriyor. Bunu … ve … göstergeleri destekliyor.’ ifadesini tamamlar.","materials":["Falih Rıfkı Atay — Bizim Akdeniz’den","P05 işaretlenmiş ilk okuma ve gözlem-betimleme tablosu","T3_ACT_06_OKUMA_SONRASI_GEZI_TAHLIL — ders kitabı s.185–192"]},{"lesson_no":2,"duration_lesson_hours":1,"title":"Anlam bulgularından gezi yazısının öğretici ve deneyim aktarıcı işlevine","objective":"Öğrencinin bilgi, gözlem, betimleme ve ileti bulgularını gezi yazısının tür işleviyle ilişkilendirmesi; metnin okura hem yer hakkında bilgi hem de yazarın deneyim/bakışını nasıl sunduğunu kanıtlarla açıklaması.","outcome_codes":["TDE2.2","TDE2.3"],"opening":"İlk saatten bir doğrudan bilgi ile bir yazar gözlemi yan yana getirilir. ‘Bu metinden yalnız yer hakkında bilgi mi ediniyoruz, yoksa yazarın o yeri görme biçimini de mi öğreniyoruz?’ sorusuyla tür işlevine geçilir.","teacher_actions":["Gezi yazısının tür özelliklerini kaynakta gözlenen öğrenci eylemlerinden hareketle kur; ezber bir özellik listesi vermek yerine metin kanıtlarından genelleme yaptır.","Öğrenciden en az üç kanıtı ‘bilgilendirme / gözlem-deneyim aktarma / betimleme ile zihinde canlandırma’ işlevleri altında sınıflandırmasını iste.","Her tür özelliği için ‘özellik → metin kanıtı → okur üzerindeki işlev’ zinciri kurdur.","Yazarın bakışını biyografik veya tarihsel varsayımlarla açıklama; yalnız metindeki seçim, gözlem ve betimleme göstergelerine dayan.","Saat sonunda gezi yazısının öğretici yönünü P05’teki ilk hipotezle karşılaştır; mekânsal düzen, anlatım akışı ve belirteç çözümlemesini P07’ye bırak."],"student_actions":["Metinden en az üç örneği bilgilendirme, gözlem/deneyim aktarma ve betimleme işlevleriyle ilişkilendirir.","Gezi yazısının en az iki tür özelliğini metin kanıtlarından türetir.","Her özellik için okura ne kazandırdığını açıklar.","P05’teki ‘gezi yazısının öğretici yönü’ hipotezini metin kanıtlarıyla doğrular veya düzeltir.","Yazarın bakışıyla kendi yorumunu birbirinden ayırarak kısa tür sentezi yazar."],"activity_ids":["T3_ACT_06_OKUMA_SONRASI_GEZI_TAHLIL"],"form_ids":[],"assessment":"Ana ürün ‘tür özelliği → metin kanıtı → işlev’ tablosudur. Özelliklerin ezber tanımdan değil incelenen metindeki bilgi, gözlem ve betimleme ilişkilerinden türetilmesi beklenir.","closure":"Öğrenci ‘Bu metni gezi yazısı yapan önemli özelliklerden biri …; bunu … göstergesi kanıtlıyor ve okura … sağlıyor.’ cümlesini tamamlar.","materials":["Falih Rıfkı Atay — Bizim Akdeniz’den","P06 ilk saat anlam kayıtları","T3_ACT_06_OKUMA_SONRASI_GEZI_TAHLIL — ders kitabı s.185–192"]}],"teacher_notes":"Bu paket BLOCK_T3_01_OKUMA bloğunun pedagojik olarak tasarlanmış 11. ve 12. saatleridir; resmî MEB saat-saat alt sıralaması değildir. Tema 3 alignment TDE2.2 kapsamında bilinmeyen kelimeleri bağlamdan çıkarma, açık/örtük iletileri ve tür özelliklerini belirlemeyi; TDE2.3 kapsamında metin çözümlemeyi bekler. Paket P05’teki bilgi-gözlem-betimleme ayrımını anlam ve tür işlevine dönüştürür; mekânsal yapı, anlatım düzeni, belirteç ve T3_ACT_07 kontrol noktası sonraki paketlere bırakılır.","continuation_summary":{"planned_now_hours":2,"remaining_block_hours":3,"covered_outcome_codes":["TDE2.1","TDE2.2","TDE2.3"],"used_activity_ids":["T3_ACT_01_OKUMA_ONCESI_HIKAYE","T3_ACT_02_OKUMA_SIRASI_HIKAYE","T3_ACT_03_OKUMA_SONRASI_HIKAYE_TAHLIL","T3_ACT_04_KONTROL_NOKTASI_HIKAYE","T3_ACT_05_OKUMA_ONCESI_GEZI","T3_ACT_06_OKUMA_SONRASI_GEZI_TAHLIL"],"next_step_hint":"P07’de T3_ACT_06 kapsamında gezi yazısının mekânsal/anlatı düzeni, betimleme-bilgilendirme geçişleri ve kaynakta TDE2.3 altında izlenen belirteçlerin metin içi işlevi çözümlenmeli; P08’de T3_ACT_07 ile 1 saatlik kontrol ve blok sentezi yapılmalıdır."}}