{
  "schema_version":"1.0.0","course_id":"TDE_10","theme_id":"TEMA_02","block_id":"BLOCK_T2_02_YAZMA","lesson_hours":2,
  "plan_title":"Akran ve Resmî Değerlendirmeden Tek Final Revizyon Hedefi Çıkarmak",
  "plan_summary":"Tema 2 Yazma bloğunun 7-8. saatlerinde T2_ACT_10_YAZMA_DEGERLENDIRME kapsamında FORM_T2_YAZMA_AKRAN ve resmî LINK_T2_YAZMA_DPA kullanılır. Öğrenci revize edebî metni bir akranıyla kanıta dayalı biçimde değerlendirir; öğretmen resmî EBA DPA'ya erişebiliyorsa aracı aynen uygular. DPA hedefi auth-gated olduğundan erişilemeyen durumda kriter, düzey veya puanlama yapısı uydurulmaz. Akran, öz-kontrol ve varsa resmî öğretmen geri bildirimi tek puanda eritilmez; P05 için tek gözlenebilir ve ürün üzerinde uygulanabilir final revizyon önceliği seçilir.",
  "outcome_codes":["TDE4.2","TDE4.3","TDE4.4"],"used_activity_ids":["T2_ACT_10_YAZMA_DEGERLENDIRME"],"used_form_ids":["FORM_T2_YAZMA_AKRAN","LINK_T2_YAZMA_DPA"],
  "lessons":[
    {"lesson_no":1,"duration_lesson_hours":1,"title":"Kanıta dayalı akran değerlendirmesi","objective":"Revize taslağı FORM_T2_YAZMA_AKRAN ile genel beğeni yerine ürün kanıtlarına dayanarak değerlendirmek.","outcome_codes":["TDE4.3","TDE4.4"],"opening":"P03 kontrol listesinde seçilen kontrol odağı akrana bildirilir.","teacher_actions":["FORM_T2_YAZMA_AKRAN'ı kaynakta olduğu biçimde kullandır.","Akran geri bildirimini kişisel beğeniye değil bilgi korunumu, edebî dönüşüm, dil ve bütünlük gibi gözlenebilir ürün özelliklerine bağla.","Her geliştirme önerisi için metinden somut kanıt iste.","Akranın metni yeniden yazmasına izin verme; yalnız kanıt ve öneri üretmesini sağla."],"student_actions":["Akran formunu doldurur.","En az bir güçlü yön ve bir geliştirme önerisini metin kanıtıyla açıklar.","Kendi metnine gelen geri bildirimi P03 öz-kontrol kaydıyla karşılaştırır."],"activity_ids":["T2_ACT_10_YAZMA_DEGERLENDIRME"],"form_ids":["FORM_T2_YAZMA_AKRAN"],"assessment":"Doldurulmuş akran formu + kanıtlı güçlü yön/gelişim önerisi.","closure":"Öğrenci akran geri bildiriminde en ikna edici bulduğu kanıtı seçer.","materials":["Revize taslak","FORM_T2_YAZMA_AKRAN — s.128","P03 kontrol listesi"]},
    {"lesson_no":2,"duration_lesson_hours":1,"title":"Resmî DPA geri bildirimi ve tek final revizyon önceliği","objective":"Erişilebilen resmî öğretmen değerlendirmesi ile öz/akran kanıtlarını işlevlerini bozmadan karşılaştırıp P05 için tek final revizyon hedefi belirlemek.","outcome_codes":["TDE4.4"],"opening":"Öz-kontrol ve akran kanıtları yan yana açılır; varsa resmî DPA sonucu eklenir.","teacher_actions":["LINK_T2_YAZMA_DPA'ya erişilebiliyorsa EBA aracını aynen kullan.","Erişilemiyorsa DPA kriteri, düzeyi veya puanı uydurma; resmî öğretmen değerlendirmesini beklemede bırak.","Öz-kontrol, akran ve varsa DPA bulgularını tek puan ortalamasına dönüştürme.","Öğrenciden tekrar eden veya ürün üzerinde en yüksek etkili bulgudan yalnız bir final revizyon hedefi seçmesini iste.","Hedefi 'daha iyi yazacağım' gibi genel değil, belirli bölüm/davranış/değişiklik olarak yazdır."],"student_actions":["Farklı geri bildirim kaynaklarını karşılaştırır.","Tek final revizyon hedefi seçer.","Hedefi mevcut metin kanıtı ve beklenen değişimle yazar."],"activity_ids":["T2_ACT_10_YAZMA_DEGERLENDIRME"],"form_ids":["FORM_T2_YAZMA_AKRAN","LINK_T2_YAZMA_DPA"],"assessment":"geri bildirim kaynağı → ürün kanıtı → tek P05 revizyon hedefi kaydı.","closure":"Öğrenci P05'te hangi bölümü neden değiştireceğini tek cümlede açıklar.","materials":["P03 öz-kontrol kaydı","FORM_T2_YAZMA_AKRAN","LINK_T2_YAZMA_DPA — resmî EBA bağlantısı"]}
  ],
  "teacher_notes":"LINK_T2_YAZMA_DPA resmî EBA hedefidir ancak yapısı auth-gated olduğundan kriterleri çıkarılamaz. Erişim yokken hiçbir rubrik veya puanlama modeli türetilmez.",
  "continuation_summary":{"planned_now_hours":2,"remaining_block_hours":2,"covered_outcome_codes":["TDE4.2","TDE4.3","TDE4.4"],"used_activity_ids":["T2_ACT_10_YAZMA_DEGERLENDIRME"],"next_step_hint":"P05'te yalnız seçilen final revizyon hedefini uygula, önce/sonra kanıtı tut ve Yazma bloğunu 10/10 kapat."}
}