{
  "schema_version":"1.0.0","course_id":"TDE_10","theme_id":"TEMA_03","block_id":"BLOCK_T3_04_YAZMA","lesson_hours":2,
  "plan_title":"Fabl İlk Taslağı: Planı Tutarlı Kurmacaya Dönüştürmek",
  "plan_summary":"Tema 3 Yazma bloğunun 3-4. saatlerinde T3_ACT_16_FABL_YAZMA kullanılır. P01 planı ilk tam fabl taslağına dönüştürülür. Öğrenciler olayların nedenselliğini, karakter işlevlerini, ana iletiyi, anlatıcı ve söz varlığı tercihlerinin tutarlılığını korur. İkinci saatte taslak geriye doğru planla karşılaştırılır; kopukluklar işaretlenir fakat ayrıntılı redaksiyon P03'e bırakılır.",
  "outcome_codes":["TDE4.1","TDE4.2","TDE4.3"],"used_activity_ids":["T3_ACT_16_FABL_YAZMA"],"used_form_ids":[],
  "lessons":[
    {"lesson_no":1,"duration_lesson_hours":1,"title":"Planı ilk tam fabl taslağına dönüştürme","objective":"Planlanan olay, karakter, ileti ve anlatıcı kararlarını tutarlı ilk taslakta uygulamak.","outcome_codes":["TDE4.1","TDE4.2","TDE4.3"],"opening":"P01 planındaki zorunlu kararlar kısa kontrol edilir.","teacher_actions":["Öğrencinin olayları yalnız sıralamasını değil nedensellik kurmasını sağla.","Karakter davranışlarının seçilen iletiyle bağını sorgulat.","Anlatıcı ve söz varlığı tercihlerinin metin boyunca tutarlılığını izle.","İlk taslakta aşırı cümle düzeltmesine girme; akışı tamamlat."],"student_actions":["İlk tam fabl taslağını yazar.","Olaylar arasında nedensellik kurar.","Karakter ve ileti bütünlüğünü korur.","Anlatıcı/dil tercihini uygular."],"activity_ids":["T3_ACT_16_FABL_YAZMA"],"form_ids":[],"assessment":"tam ilk taslak + plan kararlarının uygulanma izi.","closure":"Taslak tamamlanır; üç kritik karar işaretlenir.","materials":["P01 fabl planı"]},
    {"lesson_no":2,"duration_lesson_hours":1,"title":"Taslağı plana geri bağlama ve revizyon alanlarını belirleme","objective":"İlk taslağın planla tutarlılığını kontrol ederek P03 için somut revizyon alanları belirlemek.","outcome_codes":["TDE4.1","TDE4.2","TDE4.3"],"opening":"Taslak ile P01 planı yan yana açılır.","teacher_actions":["Her temel olayın plandaki işlevini kontrol ettir.","İletiyi doğrudan açıklayan gereksiz cümlelerle olayın kendisinin taşıdığı anlamı ayırt ettir.","Anlatıcı, zaman, kişi ve söz varlığı tutarsızlıklarını işaretlet.","Henüz öz/akran/DPA değerlendirmesine geçme."],"student_actions":["Taslağı planla karşılaştırır.","Tutarsızlıkları işaretler.","En fazla üç revizyon alanı belirler.","P03 için redaksiyon önceliği oluşturur."],"activity_ids":["T3_ACT_16_FABL_YAZMA"],"form_ids":[],"assessment":"plan kararı → taslaktaki karşılık → sorun/koru kararı.","closure":"P03 için önceliklendirilmiş revizyon listesi hazırlanır.","materials":["İlk taslak","P01 planı"]}
  ],
  "teacher_notes":"İlk taslak üretim paketidir; summative değerlendirme değildir.",
  "continuation_summary":{"planned_now_hours":2,"remaining_block_hours":6,"covered_outcome_codes":["TDE4.1","TDE4.2","TDE4.3"],"used_activity_ids":["T3_ACT_16_FABL_YAZMA"],"next_step_hint":"P03'te içerik/yapı ve dil-kural redaksiyonu iki turda yapılmalı."}
}
