{"schema_version":"1.0.0","course_id":"TDE_9","theme_id":"TEMA_01","block_id":"BLOCK_T1_02_DINLEME","lesson_hours":2,"plan_title":"Mülakatın Anlam Örgüsü: Ana Düşünce, Amaç ve Kanıta Dayalı Çıkarım","plan_summary":"8 saatlik 1. Tema Dinleme/İzleme bloğunun 3. ve 4. ders saatlerinde öğrenciler, P01'de tuttukları yapılandırılmış izleme notlarını ders kitabındaki T1_ACT_12_DINLEME_SONRASI_KARSILASTIRMA etkinliğinin anlama-çözümleme sorularıyla sınar. İlk saatte konu, ana düşünce ve yardımcı düşünceler; ikinci saatte konuşanın amacı, açıkça verilen bilgiler ile çıkarımlar ve açık/örtük iletiler kanıta dayalı biçimde çözümlenir. Edebî dil–günlük dil karşılaştırma tablosunun sistematik doldurulması P03'e bırakılır.","outcome_codes":["TDE1.2"],"used_activity_ids":["T1_ACT_12_DINLEME_SONRASI_KARSILASTIRMA"],"used_form_ids":[],"lessons":[{"lesson_no":1,"duration_lesson_hours":1,"title":"Konu, ana düşünce ve yardımcı düşünceleri izleme notlarından kurma","objective":"Öğrencinin mülakatın konusunu, ana düşüncesini ve yardımcı düşüncelerini P01'deki izleme notları ve ders kitabındaki anlama-çözümleme soruları üzerinden ayırması; her belirleme için video/not kanıtı göstermesi.","outcome_codes":["TDE1.2"],"opening":"P01 sonunda seçilen bir doğrudan bilgi ve bir çıkarım tahtaya taşınır. Öğrencilere 'Bu iki nottan hangisi metnin ne hakkında olduğunu, hangisi konuşanın asıl ne söylediğini anlamamıza daha çok yardım ediyor?' sorusu yöneltilir.","teacher_actions":["Ders kitabı s. 59-62'deki T1_ACT_12 anlama ve çözümleme sorularını ana iskelet olarak kullan.","'Konu' ile 'ana düşünce'yi ayırmak için 'Ne hakkında konuşuluyor?' ve 'Bu konuda asıl ne söyleniyor?' sorularını ayrı ayrı uygulat.","Öğrencilerden ana düşünce için P01 izleme notlarından en az iki dayanak seçmesini iste.","Yardımcı düşünceleri yalnız listeletme; her birinin ana düşünceyi nasıl açıkladığını veya desteklediğini kısa ilişki cümleleriyle kurdur.","İzleme notuyla ders kitabındaki soru cevabı çelişirse öğrenciyi videoya/notlara geri döndür; cevabı öğretmen açıklamasıyla kapatma."],"student_actions":["Mülakatın konusunu kısa ve yargısız biçimde belirler.","Ana düşünceyi kendi cümlesiyle ifade eder.","Ana düşünce için izleme notlarından iki kanıt seçer.","Yardımcı düşünceleri ana düşünceyle ilişkilendirir.","İlk notlarını anlama-çözümleme sorularına göre düzeltir veya tamamlar."],"activity_ids":["T1_ACT_12_DINLEME_SONRASI_KARSILASTIRMA"],"form_ids":[],"assessment":"Öğrenciden 'konu + ana düşünce + iki kanıt + bir yardımcı düşünce ilişkisi' içeren kısa çözümleme kaydı alınır. Ana düşüncenin videodan bağımsız genel bir yorum değil, izleme kanıtlarına dayalı olması beklenir.","closure":"Öğrenciler 'Mülakatın asıl düşüncesi …; bunu özellikle … ve … notları destekliyor.' cümlesini tamamlar. Bu çıktı ikinci dersin amaç ve çıkarım çalışmasına temel olur.","materials":["9. sınıf Türk Dili ve Edebiyatı ders kitabı s. 59-62","Selim İleri ile mülakat — ders kitabındaki karekod/video içeriği","P01 yapılandırılmış izleme notları"]},{"lesson_no":2,"duration_lesson_hours":1,"title":"Konuşanın amacı, açık bilgiler ve örtük iletiler","objective":"Öğrencinin mülakatta açıkça sunulan bilgi ile kendi çıkarımını ayırması; konuşanın amacını ve açık/örtük iletileri izleme kanıtlarından hareketle gerekçelendirmesi.","outcome_codes":["TDE1.2"],"opening":"Birinci dersten seçilen bir ana düşünce cümlesi üzerinden 'Bu düşünce videoda doğrudan mı söyleniyor, yoksa birden çok göstergeden mi çıkarılıyor?' sorusu sorulur.","teacher_actions":["T1_ACT_12'nin çıkarım ve çözümleme sorularını merkeze al; her cevapta doğrudan bilgi ile çıkarımı görünür biçimde ayır.","Tahtada 'Duydum/Gördüm' ve 'Buradan Çıkardım' iki sütununu kullan; öğrencilerin yorumlarını ikinci sütuna kanıtıyla yerleştir.","Konuşanın amacı hakkında tek sözcüklü etiket yerine 'konuşan … yapmayı amaçlıyor; bunu … göstergesinden çıkarıyorum' yapısında cümle kurdur.","Açık ve örtük iletileri belirlerken aynı kanıtın farklı yorumlara yol açabileceğini göster; metin/video kanıtı olmayan yorumu kabul etme.","Ders sonunda P01'deki ilk tahminlerden birini yeni çözümleme ışığında yeniden değerlendir."],"student_actions":["Açıkça sunulan bilgi ile kendi çıkarımını ayırır.","Konuşanın amacını video/not kanıtıyla açıklar.","Açık ve örtük iletilere ilişkin örnekler belirler.","Bir çıkarımını hangi göstergeden ürettiğini açıklar.","P01'deki bir tahminini yeni kanıta göre korur, değiştirir veya reddeder."],"activity_ids":["T1_ACT_12_DINLEME_SONRASI_KARSILASTIRMA"],"form_ids":[],"assessment":"Çıkış görevi üç parçalıdır: bir doğrudan bilgi, bu bilgiden veya başka bir göstergeden üretilen bir çıkarım ve konuşanın amacına ilişkin kanıtlı bir cümle. Yorum ile kanıtın birbirinden ayrılması esas alınır.","closure":"P03 için 'Mülakattaki günlük söyleyiş ile daha önce okuduğumuz edebî söyleyiş hangi ölçütlerle karşılaştırılabilir?' sorusu bırakılır; karşılaştırma için henüz cevap verilmez.","materials":["9. sınıf Türk Dili ve Edebiyatı ders kitabı s. 59-62","Selim İleri ile mülakat","P01-P02 izleme ve çözümleme notları"]}],"teacher_notes":"Bu paket BLOCK_T1_02_DINLEME bloğunun pedagojik olarak tasarlanmış 3. ve 4. saatleridir; resmî MEB saat-saat alt sıralaması değildir. Ana canonical etkinlik T1_ACT_12_DINLEME_SONRASI_KARSILASTIRMA'dır. Paket anlama ve çıkarım boyutuna ayrılmış; edebî dil–günlük dil karşılaştırma tablosunun sistematik kullanımı P03'e bırakılmıştır.","continuation_summary":{"planned_now_hours":2,"remaining_block_hours":4,"covered_outcome_codes":["TDE1.1","TDE1.2"],"used_activity_ids":["T1_ACT_11_DINLEME_ONCESI_VE_SIRASI","T1_ACT_12_DINLEME_SONRASI_KARSILASTIRMA"],"next_step_hint":"P03'te T1_ACT_12 içindeki Edebî Dil / Günlük Dil Karşılaştırma Tablosunu merkeze al. “San'at” şiirinden yalnız karşılaştırma kanıtı olarak yararlan; Okuma bloğunu yeniden öğretme. Ölçütleri dilin kullanım amacı, söz seçimi/ifade biçimi ve oluşturduğu etki üzerinden kanıtla doldur."}}