{
  "schema_version":"1.0.0","course_id":"TDE_10","theme_id":"TEMA_02","block_id":"BLOCK_T2_02_YAZMA","lesson_hours":2,
  "plan_title":"Bilgiden Edebî Tasarıma: Korunacak Bilgiyi Ayırma ve Dönüşüm Planı",
  "plan_summary":"Tema 2 Yazma bloğunun 1-2. saatlerinde T2_ACT_08_YAZMA_PLAN kullanılır. Öğrenciler dönüştürülecek bilgilendirici metindeki temel bilgi/ilişkileri, yorum ve ayrıntılardan ayırır; hangi bilgilerin edebî dönüşümde korunması gerektiğini gerekçelendirir. Ardından amaç, hedef okur, seçilecek edebî tür/anlatım yaklaşımı, olay/kişi/mekân ya da imge düzeni ve söz varlığı tercihlerine ilişkin dönüşüm planı oluşturur. Okuma bloğundan gelen imge, ritim ve üslup kanıtları örnek repertuvar olarak kullanılabilir fakat kaynak bilgilendirici metnin içeriğini değiştirme yetkisi vermez.",
  "outcome_codes":["TDE4.1","TDE4.2"],"used_activity_ids":["T2_ACT_08_YAZMA_PLAN"],"used_form_ids":[],
  "lessons":[
    {"lesson_no":1,"duration_lesson_hours":1,"title":"Korunacak temel bilgiyi belirleme","objective":"Bilgilendirici metindeki vazgeçilmez bilgi çekirdeğini çıkarıp edebî dönüşümde korunacak unsurları gerekçelendirmek.","outcome_codes":["TDE4.1","TDE4.2"],"opening":"Kaynak metin okunur ve 'bilgi / örnek-ayrıntı / yorum' ayrımı yapılır.","teacher_actions":["Öğrenciden temel bilgi ve ilişkileri kaynak metin üzerinde işaretlemesini iste.","Edebîleştirme adına olgusal çekirdeğin bozulmasına izin verme.","Korunacak bilgi ile dönüştürülebilecek sunum biçimini ayrı sütunlarda kaydettir.","Kaynakta olmayan bilgi ekleme ihtiyacını ayrıca işaretlet; doğrulanmadan taslağa sokma."],"student_actions":["Temel bilgiyi işaretler.","Bilgi/ayrıntı/yorum ayrımı yapar.","Korunacak çekirdeği gerekçelendirir.","Dönüşebilecek anlatım alanlarını belirler."],"activity_ids":["T2_ACT_08_YAZMA_PLAN"],"form_ids":[],"assessment":"kaynak ifade/bilgi → statü → korunma gerekçesi tablosu.","closure":"Öğrenci edebîleşse bile değişmemesi gereken üç bilgiyi belirtir.","materials":["Bilgilendirici kaynak metin","Bilgi çekirdeği tablosu","P08 okuma kanıt dosyası"]},
    {"lesson_no":2,"duration_lesson_hours":1,"title":"Edebî dönüşüm mimarisini planlama","objective":"Korunan bilgi çekirdeği için amaç, hedef okur ve edebî anlatım tercihlerini tutarlı bir plana dönüştürmek.","outcome_codes":["TDE4.1","TDE4.2"],"opening":"İlk saatin korunacak bilgi listesi sabitlenir.","teacher_actions":["Amaç ve hedef okuru netleştir.","Öğrencinin edebî tür/anlatım yaklaşımı seçimini kaynak bilgiyle ilişkilendirmesini iste.","Olay/kişi/mekân, anlatıcı, imge veya ritim gibi araçlardan yalnız seçilen dönüşüme hizmet edenleri kullandır.","P08 şiir kanıtlarını hazır kalıp olarak kopyalatma; yalnız işlevsel örnek repertuvar olarak kullandır."],"student_actions":["Amaç ve hedef okur belirler.","Edebî anlatım yaklaşımını seçer.","Bilgilerin metin içindeki yeni düzenini planlar.","Dil/söz varlığı ve gerekirse görsel/işitsel öge kullanımını gerekçelendirir."],"activity_ids":["T2_ACT_08_YAZMA_PLAN"],"form_ids":[],"assessment":"korunacak bilgi → edebî araç/yerleşim → amaç/okur işlevi dönüşüm planı.","closure":"Öğrenci bir bilgiyi neden belirli bir edebî araçla sunacağını açıklar.","materials":["Bilgi çekirdeği tablosu","Dönüşüm planı şablonu","P08 okuma kanıt dosyası"]}
  ],
  "teacher_notes":"Bu paket ilk taslağı yazdırmaz; bilginin doğruluğu ile edebî sunum biçimini ayıran planlama aşamasıdır.",
  "continuation_summary":{"planned_now_hours":2,"remaining_block_hours":8,"covered_outcome_codes":["TDE4.1","TDE4.2"],"used_activity_ids":["T2_ACT_08_YAZMA_PLAN"],"next_step_hint":"P02'de T2_ACT_09 kapsamında planı ilk tam edebî taslağa dönüştür; korunacak bilgi çekirdeğini her bölümle izlenebilir tut."}
}