{
  "schema_version":"1.0.0","course_id":"TDE_10","theme_id":"TEMA_04","block_id":"BLOCK_T4_04_YAZMA","lesson_hours":2,
  "plan_title":"Şiiri Çok Kaynaklı Değerlendirmek: Akran, Öğretmen Rubriği ve Tek Revizyon Hedefi",
  "plan_summary":"Tema 4 Yazma bloğunun 7-8. saatlerinde T4_ACT_18_SIIR_DEGERLENDIRME sürdürülür. Öğrenciler FORM_T4_YAZMA_AKRAN üzerinden somut metin kanıtına dayalı akran geri bildirimi verir. Öğretmen değerlendirmesinde LINK_T4_YAZMA_DPA resmî kaynak bağı korunur; exact EBA payload erişilebilir değilse repo tarafından owner-authorized application support olarak kabul edilen TDE10_YAZMA_RUBRIC / FORM_T10_T4_YAZMA_DPA_CANONICAL kullanılır ve bunun EBA exact eşdeğeri olduğu iddia edilmez. Akran, süreç checklist'i ve öğretmen rubriği tek puana karıştırılmaz; P05 için yalnız bir final revizyon önceliği seçilir.",
  "outcome_codes":["TDE4.2","TDE4.3","TDE4.4"],"used_activity_ids":["T4_ACT_18_SIIR_DEGERLENDIRME"],"used_form_ids":["FORM_T4_YAZMA_AKRAN","LINK_T4_YAZMA_DPA"],
  "lessons":[
    {"lesson_no":1,"duration_lesson_hours":1,"title":"Akran geri bildirimi: kişiye değil metne","objective":"Şiiri FORM_T4_YAZMA_AKRAN ile metin kanıtına dayalı biçimde değerlendirmek ve kullanılabilir geri bildirim üretmek.","outcome_codes":["TDE4.4"],"opening":"P03 değerlendirme sürümü ve kaynak anlam kontrolü açılır.","teacher_actions":["Akran değerlendirmesini şiirde gözlenebilir unsurlara bağlat.","Genel beğeni, kişilik veya yazar niyeti tahmini yerine metin kanıtı iste.","Her gelişim önerisinde 'nerede/ne değişirse/ne kazanır?' yapısını kullandır."],"student_actions":["FORM_T4_YAZMA_AKRAN'ı doldurur.","Bir güçlü yönü ve bir gelişim önerisini metin kanıtıyla gerekçelendirir.","Kendi şiirine gelen geri bildirimi kanıtla karşılaştırır."],"activity_ids":["T4_ACT_18_SIIR_DEGERLENDIRME"],"form_ids":["FORM_T4_YAZMA_AKRAN"],"assessment":"metin kanıtı → akran yargısı → uygulanabilir öneri.","closure":"Akran geri bildiriminden gerçekten işe yarayabilecek bir aday revizyon belirlenir.","materials":["Değerlendirme sürümü","FORM_T4_YAZMA_AKRAN"]},
    {"lesson_no":2,"duration_lesson_hours":1,"title":"Öğretmen değerlendirmesi ve tek final revizyon hedefi","objective":"Öğretmen rubriği, akran geri bildirimi ve süreç kanıtlarını rolleri karıştırmadan yorumlayıp P05 için tek gözlenebilir revizyon hedefi seçmek.","outcome_codes":["TDE4.2","TDE4.3","TDE4.4"],"opening":"Akran geri bildirimi ile P03 süreç checklist'i yan yana getirilir.","teacher_actions":["Resmî DPA erişilebiliyorsa exact aracı kullan; erişilemiyorsa assessment_gate_audit'ın izin verdiği TDE10_YAZMA_RUBRIC / FORM_T10_T4_YAZMA_DPA_CANONICAL desteğini kullan.","Canonical desteğin exact EBA payload eşdeğeri olmadığını açık tut.","Akran, checklist ve öğretmen rubriğini aritmetik olarak birleştirme.","Öğrenciye yalnız bir final revizyon önceliği seçtir: tema aktarımı, içerik, etkililik, şiir dili, söz varlığı, üslup/estetik veya dil bilgisi gibi gözlenebilir bir alan."],"student_actions":["Farklı geri bildirim kaynaklarını ayrı okur.","Tekrarlanan ve kaynağa özgü bulguları ayırır.","P05 için tek revizyon hedefi ve kanıtını yazar."],"activity_ids":["T4_ACT_18_SIIR_DEGERLENDIRME"],"form_ids":["LINK_T4_YAZMA_DPA"],"assessment":"geri bildirim kaynağı → somut kanıt → tek revizyon önceliği.","closure":"P05 öncesi hedef 'mevcut kanıt → değişecek bölüm → beklenen etki' biçiminde dondurulur.","materials":["FORM_T4_YAZMA_AKRAN","FORM_T4_YAZMA_KONTROL","LINK_T4_YAZMA_DPA","TDE10_YAZMA_RUBRIC canonical support"]}
  ],
  "teacher_notes":"assessment_gate_audit, TDE10_YAZMA_RUBRIC desteğini owner-authorized canonical uygulama desteği olarak açmıştır; EBA external target ile exact eşdeğerlik doğrulanmış değildir. Bu ayrım öğretmen notunda korunmalıdır. Akran ve süreç araçlarından yapay bir birleşik puan üretilmez.",
  "continuation_summary":{"planned_now_hours":2,"remaining_block_hours":2,"covered_outcome_codes":["TDE4.2","TDE4.3","TDE4.4"],"used_activity_ids":["T4_ACT_18_SIIR_DEGERLENDIRME"],"next_step_hint":"P05'te yalnız seçilen tek final revizyonu uygula; ardından T4_ACT_19 ve T4_ACT_20 ile Tema 4 ve 10. sınıf çekirdek öğretimi kapat."}
}
