{"schema_version":"1.0.0","course_id":"TDE_9","theme_id":"TEMA_01","block_id":"BLOCK_T1_01_OKUMA","lesson_hours":2,"plan_title":"Denemenin Düşünce Omurgası: Ana Düşünce ve Yazarın Bakış Açısı","plan_summary":"15 saatlik 1. Tema Okuma bloğunun 9. ve 10. ders saatlerinde öğrenciler, Rasim Özdenören'in “Picasso'nun Hatları” denemesini ders kitabındaki T1_ACT_08_OKUMA_SONRASI_DENEME_TAHLIL etkinliği üzerinden ayrıntılı biçimde çözümler. İlk saatte metnin konu, ana düşünce ve yardımcı düşünce yapısı; ikinci saatte yazarın bakış açısı, amacı ve düşünceler arasındaki ilişki metin kanıtıyla belirlenir. Düşünceyi geliştirme yollarının sistematik çözümlemesi P06'ya bırakılır.","outcome_codes":["TDE2.2"],"used_activity_ids":["T1_ACT_08_OKUMA_SONRASI_DENEME_TAHLIL"],"used_form_ids":[],"lessons":[{"lesson_no":1,"duration_lesson_hours":1,"title":"Konu, ana düşünce ve yardımcı düşünceleri kanıtla ayırma","objective":"Öğrencinin “Picasso'nun Hatları” denemesinin konusunu, ana düşüncesini ve yardımcı düşüncelerini birbirinden ayırması; her belirleme için metinden dayanak göstermesi ve ana düşünceyi metnin düşünce akışıyla ilişkilendirmesi.","outcome_codes":["TDE2.2"],"opening":"P04 sonunda tahtada bırakılan 'Metnin ana düşüncesi ne?' sorusuna öğrenciler bireysel olarak tek cümlelik ilk cevap verir. Cevaplar hemen doğrulanmaz; dersin amacı bu ilk cümlenin metin kanıtıyla sınanması olarak açıklanır.","teacher_actions":["Ders kitabı s. 42-50'deki T1_ACT_08 anlama ve tahlil sorularını temel alarak öğrencileri metnin konu, ana düşünce ve yardımcı düşünce yapısını ayırmaya yönlendir.","'Metin ne hakkında?' ile 'Yazar bu konu hakkında ne söylüyor?' sorularını ayrı tutarak konu–ana düşünce karışıklığını görünür kıl.","Öğrencilerin seçtikleri ana düşünce cümlesi için metindeki en az iki düşünce/ifade ile destek istemesini sağla.","Yardımcı düşünceleri yalnız listeletme; her birinin ana düşünceyi nasıl desteklediğini oklarla veya kısa ilişki cümleleriyle gösterdir.","Ders sonunda ilk ana düşünce cümlesi ile kanıt sonrası revize edilmiş cümleyi karşılaştırmalarını iste."],"student_actions":["Denemenin konusunu kısa ve yargısız bir ifadeyle belirler.","Yazarın temel savını ana düşünce olarak kendi cümlesiyle ifade eder.","Ana düşünceyi destekleyen metin parçalarını seçer.","Yardımcı düşünceleri belirleyip ana düşünceyle ilişkisini açıklar.","İlk tahmin ettiği ana düşünceyi metin kanıtlarına göre gözden geçirir ve gerektiğinde düzeltir."],"activity_ids":["T1_ACT_08_OKUMA_SONRASI_DENEME_TAHLIL"],"form_ids":[],"assessment":"Öğrencinin ürettiği 'konu + ana düşünce + iki dayanak + en az bir yardımcı düşünce ilişkisi' kısa çözümleme kaydı değerlendirilir. Ana düşüncenin metinden kopuk genel bir sanat yargısına dönüşmemesi; denemenin düşünce akışına dayanması beklenir.","closure":"Öğrenciler 'Yazarın asıl söylemek istediği …; bunu özellikle … ve … düşünceleriyle destekliyor.' kalıbını doldurur. Bu çıktı ikinci derste yazarın bakış açısının incelenmesinde başlangıç verisi olur.","materials":["9. sınıf Türk Dili ve Edebiyatı ders kitabı s. 40-50","“Picasso'nun Hatları” — Rasim Özdenören","Ders kitabındaki T1_ACT_08 anlama ve tahlil soruları"]},{"lesson_no":2,"duration_lesson_hours":1,"title":"Yazarın bakış açısını ve amacını metin kanıtıyla çözümleme","objective":"Öğrencinin denemedeki değerlendirme ve yorumlardan hareketle yazarın konuya yaklaşımını ve yazma amacını belirlemesi; bu çıkarımları metindeki ifade ve düşünce ilişkileriyle gerekçelendirmesi.","outcome_codes":["TDE2.2"],"opening":"Birinci dersten seçilen iki ana düşünce cümlesi karşılaştırılır ve 'Aynı konu başka bir yazar tarafından farklı nasıl ele alınabilirdi?' sorusuyla konu ile bakış açısı arasındaki fark sezdirilir.","teacher_actions":["T1_ACT_08'in yazarın yaklaşımı ve metnin düşünce yapısıyla ilgili sorularını merkeze al.","Öğrencilerden yazarın bakış açısını tek bir sıfatla etiketlemek yerine 'yazar … konusunda … düşünür; bunu … ifadesinden çıkarıyorum' biçiminde kanıtlı cümle kurmalarını iste.","Yazarın amacıyla ana düşünce arasındaki ilişkiyi sorgulat: savunma, açıklama, sorgulama veya değerlendirme gibi işlevleri ancak metin kanıtı elverdiği ölçüde tartıştır.","Öznel değerlendirme ile metinde doğrudan sunulan bilgi/iddia arasındaki ayrımı örnekler üzerinden yaptır; kitapta bulunmayan yazar niyeti veya biyografik açıklama ekleme.","Ders sonunda iki farklı öğrenci çıkarımını 'kanıtın doğrudanlığı ve açıklama gücü' açısından sınıfça karşılaştır."],"student_actions":["Yazarın konuya yaklaşımını metindeki ifade ve düşünceler üzerinden çıkarır.","Bakış açısına ilişkin çıkarımını en az bir metin kanıtıyla destekler.","Yazarın yazma amacı ile ana düşünce arasındaki ilişkiyi açıklar.","Metinde açıkça verilen bir düşünce ile kendi çıkarımını birbirinden ayırır.","Başka bir öğrencinin bakış açısı yorumunu kullanılan kanıtın gücü açısından değerlendirir."],"activity_ids":["T1_ACT_08_OKUMA_SONRASI_DENEME_TAHLIL"],"form_ids":[],"assessment":"Çıkış görevi: 'Yazarın bakış açısını bir cümleyle açıkla; ardından bu çıkarımı destekleyen bir metin göstergesi ve bunun neden kanıt olduğunu yaz.' Değerlendirmede yorumun doğrulanabilir metin dayanağına sahip olması esas alınır.","closure":"P06 için şu soru bırakılır: 'Yazar bu düşünceleri yalnız sıralıyor mu, yoksa onları güçlendirmek için belirli anlatım/düşünce geliştirme yolları mı kullanıyor?' Öğrenciler metinde böyle bir kullanım olabileceğini düşündükleri bir bölümü işaretler.","materials":["9. sınıf Türk Dili ve Edebiyatı ders kitabı s. 40-50","“Picasso'nun Hatları” — Rasim Özdenören","Ders kitabındaki T1_ACT_08 tahlil soruları"]}],"teacher_notes":"Bu paket BLOCK_T1_01_OKUMA bloğunun pedagojik olarak tasarlanmış 9. ve 10. ders saatleridir; resmî MEB saat-saat alt sıralaması değildir. Ana canonical etkinlik T1_ACT_08'dir. Paket bilinçli olarak ana düşünce, yardımcı düşünce, yazarın bakış açısı ve yazma amacıyla sınırlanmıştır; düşünceyi geliştirme yolları ve şiir-deneme karşılaştırması P06'ya bırakılmıştır.","continuation_summary":{"planned_now_hours":2,"remaining_block_hours":5,"covered_outcome_codes":["TDE2.1","TDE2.2"],"used_activity_ids":["T1_ACT_01_OKUMA_ONCESI_SIIR","T1_ACT_02_OKUMA_SIRASI_SIIR","T1_ACT_03_OKUMA_SONRASI_SIIR_ANLAMA","T1_ACT_04_GUZEL_SANATLAR_DISIPLINLER","T1_ACT_05_DIL_BILGISI_SES_BILGISI","T1_ACT_06_KONTROL_NOKTASI_SIIR","T1_ACT_07_OKUMA_ONCESI_DENEME","T1_ACT_08_OKUMA_SONRASI_DENEME_TAHLIL"],"next_step_hint":"P06'da aynı T1_ACT_08 etkinliği içinde düşünceyi geliştirme yollarının ana düşünceyi nasıl desteklediğini çözümle; ikinci saatte “San'at” şiiri ile “Picasso'nun Hatları” denemesini dil kullanımı, estetik etki ve anlam kurma biçimi açısından karşılaştır. Karşılaştırmayı tür tanımı ezberine dönüştürme."}}