{"schema_version":"1.0.0","course_id":"TDE_9","theme_id":"TEMA_03","block_id":"BLOCK_T3_01_OKUMA","lesson_hours":1,"plan_title":"Tema 3 Okuma Kapanışı: Gezi Yazısı Kontrol Noktası ve Yapı-Anlam-Dil Sentezi","plan_summary":"15 saatlik 3. Tema Okuma bloğunun son 1 ders saatinde öğrenciler T3_ACT_07_KONTROL_NOKTASI_GEZI ile ‘Bizim Akdeniz’den’ gezi yazısı kazanımlarını öz-denetimle kontrol eder. Kararsız veya eksik görülen en az bir alan için P05-P07 kanıtlarına dönülür, cevap/çıkarım gerekçeli biçimde düzeltilir ve yeniden kontrol edilir. Saatin sonunda ‘Eskici’ ile ‘Bizim Akdeniz’den’ metinlerinden birer kanıt kullanılarak hikâye ve gezi yazısında yapı, anlam ve dilin nasıl farklı işlevler üstlendiğine ilişkin kısa karşılaştırmalı çıkış kanıtı oluşturulur. Yeni içerik açılmaz; BLOCK_T3_01_OKUMA 15/15 saat tamamlanır.","outcome_codes":["TDE2.1","TDE2.2","TDE2.3"],"used_activity_ids":["T3_ACT_07_KONTROL_NOKTASI_GEZI"],"used_form_ids":[],"lessons":[{"lesson_no":1,"duration_lesson_hours":1,"title":"Kontrol noktası, kanıta dönüş ve hikâye-gezi yazısı sentezi","objective":"Öğrencinin gezi yazısı kazanımlarını kontrol noktasında kendi kanıtlarıyla değerlendirmesi; kararsız/eksik bir alanı kaynak kanıtına dönerek düzeltmesi ve Tema 3 okuma bloğunda hikâye ile gezi yazısının yapı-anlam-dil ilişkisini kısa karşılaştırmalı kanıtla sentezlemesi.","outcome_codes":["TDE2.1","TDE2.2","TDE2.3"],"opening":"T3_ACT_07_KONTROL_NOKTASI_GEZI açılır. Öğrencilere ‘Kontrolün amacı her kutuyu hızlıca işaretlemek değil; emin olmadığın yerde hangi metin kanıtına döneceğini bilmektir.’ yönergesi verilir.","teacher_actions":["T3_ACT_07_KONTROL_NOKTASI_GEZI’yi ders kitabında verildiği biçimde kullandır; yeni kontrol maddesi veya resmî ölçüt icat etme.","Öğrenciden en az bir kararsız/eksik kazanım seçmesini ve P05-P07’deki ilgili bilgi-gözlem-betimleme, tür, yapı veya belirteç kanıtına dönmesini iste.","Düzeltme döngüsünü ‘ilk/kararsız cevap → döndüğüm kanıt → gerekçeli düzeltme → yeniden kontrol’ biçiminde görünür kıl.","Kontrol tamamlandıktan sonra öğrenciden ‘Eskici’ ve ‘Bizim Akdeniz’den’ için birer kanıt seçmesini; bu kanıtlarla iki türde yapı, anlam veya dil unsurunun işlevini karşılaştırmasını iste.","Karşılaştırmayı üstünlük sıralamasına dönüştürme; farklı türlerin farklı iletişim/anlatım amaçları doğrultusunda kullandığı yapısal ve dilsel araçları kanıtla görünür kıl.","Saat sonunda yeni konuşma atölyesi içeriğine geçme; yalnız Okuma bloğunu kapat ve sonraki blok için cursor’a bırak."],"student_actions":["T3_ACT_07 kontrol noktası maddelerini kendi çalışma kanıtlarına bakarak değerlendirir.","Kararsız veya eksik gördüğü en az bir alan belirler.","P05-P07 kayıtlarından ilgili metin/etkinlik kanıtına döner ve cevabını gerekçeli biçimde düzeltir.","Kontrol maddesini yeniden değerlendirir.","‘Eskici’den bir, ‘Bizim Akdeniz’den’ bir kanıt seçerek yapı/anlam/dil işlevlerinden en az biri üzerinden kısa karşılaştırmalı sentez yazar."],"activity_ids":["T3_ACT_07_KONTROL_NOKTASI_GEZI"],"form_ids":[],"assessment":"İki kanıt birlikte aranır: (1) tamamlanmış kontrol noktası + en az bir ‘ilk/kararsız → kanıt → düzeltme → yeniden kontrol’ kaydı, (2) iki metinden birer kanıta dayanan kısa yapı-anlam-dil karşılaştırması. Türlerin aynı ölçüte zorlanması değil, kendi işlevleri içinde kanıtla karşılaştırılması beklenir.","closure":"Öğrenci ‘Kontrol noktasında … konusunda kanıta dönerek … şeklinde düzelttim. “Eskici”de … unsuru … işlevini görürken “Bizim Akdeniz’den”de … unsuru … işlevini görüyor; bunu … ve … kanıtları gösteriyor.’ cümlesini tamamlar.","materials":["T3_ACT_07_KONTROL_NOKTASI_GEZI — ders kitabı s.193","P05-P07 gezi yazısı okuma ve çözümleme kayıtları","P01-P04 Eskici çözümleme ve kontrol kayıtları"]}],"teacher_notes":"Bu paket BLOCK_T3_01_OKUMA bloğunun pedagojik olarak tasarlanmış 15. saatidir; resmî MEB saat-saat alt sıralaması değildir. Textbook map T3_ACT_07’yi ‘Kontrol Noktası: Gezi Yazısı Kazanımları’ olarak doğrular. Tema 3 alignment TDE2.1-TDE2.3 için hazırlık/işaretleme, anlam-tür, yapı-anlatım, belirteç ve kontrol listesi kanıtlarını birlikte gösterir. Paket yeni içerik üretmez; kanıta dönüş ve kısa karşılaştırmalı sentezle Okuma bloğunu 15/15 kapatır.","continuation_summary":{"planned_now_hours":1,"remaining_block_hours":0,"covered_outcome_codes":["TDE2.1","TDE2.2","TDE2.3"],"used_activity_ids":["T3_ACT_01_OKUMA_ONCESI_HIKAYE","T3_ACT_02_OKUMA_SIRASI_HIKAYE","T3_ACT_03_OKUMA_SONRASI_HIKAYE_TAHLIL","T3_ACT_04_KONTROL_NOKTASI_HIKAYE","T3_ACT_05_OKUMA_ONCESI_GEZI","T3_ACT_06_OKUMA_SONRASI_GEZI_TAHLIL","T3_ACT_07_KONTROL_NOKTASI_GEZI"],"next_step_hint":"BLOCK_T3_01_OKUMA tamamlandı. Üretim sırasındaki sonraki paket TEMA_03 / BLOCK_T3_02_KONUSMA / BLOCK_T3_02_KONUSMA_P01 — 2 saattir. Konuşma bloğuna geçmeden önce T3_ACT_08, T3_ACT_09 ve TDE9_KONUSMA_RUBRIC’in current approval durumunu fresh-read et."}}