{
  "schema_version": "1.0.0",
  "course_id": "TDE_11",
  "theme_id": "TEMA_03",
  "block_id": "BLOCK_T3_04_YAZMA",
  "lesson_hours": 2,
  "plan_title": "YAŞAMIN İZİNDE — Yazma 4: Süreci Değerlendirebilme",
  "plan_summary": "10 saatlik yazma bloğunun bu 2 saatlik bölümünde ders kitabındaki doğrulanmış etkinlikler kullanılarak ilgili öğrenme çıktısına yönelik somut öğrenci kanıtı üretilir. Saat içi akış pedagojik öneridir; resmî MEB alt-saat sıralaması olarak sunulmaz.",
  "outcome_codes": [
    "TDE4.4"
  ],
  "used_activity_ids": [
    "T3_ACT_20_YAZMA_DEGERLENDIRME"
  ],
  "used_form_ids": [],
  "lessons": [
    {
      "lesson_no": 1,
      "duration_lesson_hours": 1,
      "title": "Süreci Değerlendirebilme: kanıt üretme ve geliştirme",
      "objective": "Öğrenci, “Süreci Değerlendirebilme” etkinliğinde yazma sürecini ve ürünü öz/akran/öğretmen değerlendirmesiyle gözden geçirip geliştirir; ürettiği kanıtı gerekçelendirerek uygulama ve ilk kanıt sürecini tamamlar.",
      "outcome_codes": [
        "TDE4.4"
      ],
      "opening": "“Süreci Değerlendirebilme” görevinin amacı ile beklenen kanıt açıklanır. Öğrenci, bu ders saatinde hangi yazma davranışını göstereceğini ve sonunda hangi somut kanıtı bırakacağını kendi cümlesiyle ifade eder.",
      "teacher_actions": [
        "“Süreci Değerlendirebilme” etkinliğinin yönergesini ders kitabındaki doğrulanmış kapsamla uygula; kaynakta bulunmayan içerik veya değerlendirme ölçütü ekleme.",
        "Öğrencinin şu görevi yerine getirmesini sağla: Yazma sürecini ve ürünü öz/akran/öğretmen değerlendirmesiyle gözden geçirip geliştirir. Kararını veya yorumunu somut metin/performans/ürün göstergesiyle gerekçelendirmesini iste.",
        "“Öz/akran değerlendirme, öğretmen gözlem/değerlendirme kaydı ve revize edilmiş nihai ürün” kanıtını topla. Yalnız katılım gözlemini yeterli sayma; öğrencinin neyi nasıl gösterdiğini kaydet.",
        "Ders sırasında kısa kontrol noktaları kullan; öğrencinin yanlış veya eksik stratejiyi kanıt oluşmadan önce fark edip düzeltmesine fırsat ver."
      ],
      "student_actions": [
        "Yazma sürecini ve ürünü öz/akran/öğretmen değerlendirmesiyle gözden geçirip geliştirir.",
        "Kararını, yorumunu veya ürün tercihini somut kaynak göstergesiyle gerekçelendirir.",
        "Ürettiği kanıtı yönergeye göre kontrol eder; eksik veya belirsiz kısmı düzeltir.",
        "Kapanışta bir güçlü kanıtını ve bir geliştirme adımını kısa biçimde kaydeder."
      ],
      "activity_ids": [
        "T3_ACT_20_YAZMA_DEGERLENDIRME"
      ],
      "form_ids": [],
      "assessment": "Ana ölçme kanıtı şudur: “Öz/akran değerlendirme, öğretmen gözlem/değerlendirme kaydı ve revize edilmiş nihai ürün”. Geri bildirim, bu kanıtın doğruluğu, gerekçesi ve hedeflenen yazma becerisine uygunluğu üzerinden verilir.",
      "closure": "Öğrenci “Öz/akran değerlendirme, öğretmen gözlem/değerlendirme kaydı ve revize edilmiş nihai ürün” kanıtına bakarak bir güçlü yönünü ve bir sonraki uygulamada yapacağı tek somut değişikliği yazar.",
      "materials": [
        "Edebiyat Atölyesi-2 (Anlatma): Yazma — Diyaloğu Başka Bir Türe Dönüştürme — ders kitabı s.228",
        "Öğrencinin bu ders saatinde oluşturduğu somut kanıt kaydı"
      ]
    },
    {
      "lesson_no": 2,
      "duration_lesson_hours": 1,
      "title": "Süreci Değerlendirebilme: kanıt üretme ve geliştirme",
      "objective": "Öğrenci, “Süreci Değerlendirebilme” etkinliğinde yazma sürecini ve ürünü öz/akran/öğretmen değerlendirmesiyle gözden geçirip geliştirir; ürettiği kanıtı gerekçelendirerek kanıtı geliştirme ve düzeltme sürecini tamamlar.",
      "outcome_codes": [
        "TDE4.4"
      ],
      "opening": "“Süreci Değerlendirebilme” görevinin amacı ile beklenen kanıt açıklanır. Öğrenci, bu ders saatinde hangi yazma davranışını göstereceğini ve sonunda hangi somut kanıtı bırakacağını kendi cümlesiyle ifade eder.",
      "teacher_actions": [
        "“Süreci Değerlendirebilme” etkinliğinin yönergesini ders kitabındaki doğrulanmış kapsamla uygula; kaynakta bulunmayan içerik veya değerlendirme ölçütü ekleme.",
        "Öğrencinin şu görevi yerine getirmesini sağla: Yazma sürecini ve ürünü öz/akran/öğretmen değerlendirmesiyle gözden geçirip geliştirir. Kararını veya yorumunu somut metin/performans/ürün göstergesiyle gerekçelendirmesini iste.",
        "“Öz/akran değerlendirme, öğretmen gözlem/değerlendirme kaydı ve revize edilmiş nihai ürün” kanıtını topla. Yalnız katılım gözlemini yeterli sayma; öğrencinin neyi nasıl gösterdiğini kaydet.",
        "İlk denemeden sonra ortak bir güçlü örneği ve geliştirilmesi gereken bir örneği anonim biçimde karşılaştır; öğrencinin ikinci denemesinde neyi değiştireceğini netleştir."
      ],
      "student_actions": [
        "Yazma sürecini ve ürünü öz/akran/öğretmen değerlendirmesiyle gözden geçirip geliştirir.",
        "Kararını, yorumunu veya ürün tercihini somut kaynak göstergesiyle gerekçelendirir.",
        "Ürettiği kanıtı yönergeye göre kontrol eder; eksik veya belirsiz kısmı düzeltir.",
        "İlk kanıtı ile düzeltilmiş kanıtı karşılaştırıp hangi değişikliğin sonucu iyileştirdiğini açıklar."
      ],
      "activity_ids": [
        "T3_ACT_20_YAZMA_DEGERLENDIRME"
      ],
      "form_ids": [],
      "assessment": "Ana ölçme kanıtı şudur: “Öz/akran değerlendirme, öğretmen gözlem/değerlendirme kaydı ve revize edilmiş nihai ürün”. Geri bildirim, bu kanıtın doğruluğu, gerekçesi ve hedeflenen yazma becerisine uygunluğu üzerinden verilir.",
      "closure": "Öğrenci “Öz/akran değerlendirme, öğretmen gözlem/değerlendirme kaydı ve revize edilmiş nihai ürün” kanıtına bakarak bir güçlü yönünü ve bir sonraki uygulamada yapacağı tek somut değişikliği yazar.",
      "materials": [
        "Edebiyat Atölyesi-2 (Anlatma): Yazma — Diyaloğu Başka Bir Türe Dönüştürme — ders kitabı s.228",
        "Öğrencinin bu ders saatinde oluşturduğu somut kanıt kaydı"
      ]
    }
  ],
  "teacher_notes": "Bu paket yalnız doğrulanmış ders kitabı etkinlik/form kimliklerine ve tanımlı öğrenme çıktılarına dayanır. Dış QR bağlantısındaki doğrulanmamış dereceli puanlama anahtarı ölçüt×düzey içeriği kullanılmaz; pedagojik saat içi sıralama MEB tarafından verilmiş resmî alt-saat sıralaması değildir.",
  "continuation_summary": {
    "planned_now_hours": 2,
    "remaining_block_hours": 2,
    "covered_outcome_codes": [
      "TDE4.4"
    ],
    "used_activity_ids": [
      "T3_ACT_20_YAZMA_DEGERLENDIRME"
    ],
    "next_step_hint": "Aynı yazma bloğunda kalan 2 saatte kullanılmamış veya derinleştirilecek doğrulanmış kitap etkinlikleriyle beceri kanıtını ilerlet."
  }
}
