{
  "schema_version":"1.0.0",
  "course_id":"TDE_10","theme_id":"TEMA_01","block_id":"BLOCK_T1_04_YAZMA","lesson_hours":2,
  "plan_title":"Film Şeridini Paylaşmak: Akran Geri Bildirimi, Resmî DPA ve Tek Revizyon Önceliği",
  "plan_summary":"Tema 1 Yazma bloğunun 7-8. saatlerinde T1_ACT_16_FILM_SERIDI_DEGERLENDIRME kapsamında revize film şeritleri paylaşılır. FORM_T1_YAZMA_AKRAN kaynakta gözlenen yapısıyla kullanılır. Öğretmen, erişebiliyorsa resmî LINK_T1_YAZMA_DPA hedefini aynen kullanır; bağlantı auth-gated ise kriter, seviye veya puan uydurmaz ve öğretmen DPA değerlendirmesini beklemede bırakır. Öğrenci akran ve mevcut öğretmen geri bildiriminden P05 için tek gözlenebilir revizyon önceliği seçer.",
  "outcome_codes":["TDE4.2","TDE4.3","TDE4.4"],"used_activity_ids":["T1_ACT_16_FILM_SERIDI_DEGERLENDIRME"],"used_form_ids":["FORM_T1_YAZMA_AKRAN","LINK_T1_YAZMA_DPA"],
  "lessons":[
    {"lesson_no":1,"duration_lesson_hours":1,"title":"Akran değerlendirmesini ürün kanıtına bağlama","objective":"Öğrencinin akran formunu genel beğeni yerine gözlenebilir film şeridi kanıtlarıyla kullanması.","outcome_codes":["TDE4.4"],"opening":"P03 revize taslakları paylaşılır; geri bildirimin ürüne, kişiye değil ürüne yönelik olduğu hatırlatılır.","teacher_actions":["FORM_T1_YAZMA_AKRAN'ı kaynakta olduğu biçimde kullandır.","Her önemli akran yargısına sahne/metin/görsel kanıtı eklet.","Kişisel beğeni, çizim yeteneği veya öğrencinin kişiliğini değerlendirme konusu yapma.","Akran formunda olmayan yeni puan ölçeği üretme."],"student_actions":["Bir akran ürününü form üzerinden değerlendirir.","Geri bildirimi somut sahne veya metin kanıtına bağlar.","Kendi ürünü için bir güçlü yön ve bir geliştirme önerisi alır."],"activity_ids":["T1_ACT_16_FILM_SERIDI_DEGERLENDIRME"],"form_ids":["FORM_T1_YAZMA_AKRAN"],"assessment":"Doldurulmuş akran formu + kanıta bağlı güçlü yön/geliştirme önerisi.","closure":"Öğrenci aldığı geri bildirimin hangisinin üründe gerçekten görülebilir olduğunu belirtir.","materials":["FORM_T1_YAZMA_AKRAN — s.78","Revize film şeridi"]},
    {"lesson_no":2,"duration_lesson_hours":1,"title":"Resmî DPA kullanımı ve tek final revizyon hedefi","objective":"Resmî DPA erişim durumunu doğru yönetmek ve mevcut geri bildirimlerden tek final revizyon önceliği çıkarmak.","outcome_codes":["TDE4.4"],"opening":"Akran geri bildirimi ile P03 öz-kontrol kanıtları yan yana getirilir.","teacher_actions":["LINK_T1_YAZMA_DPA'ya erişim varsa resmî hedefi olduğu gibi kullan; kriter veya seviye ekleme/çıkarma yapma.","DPA hedefi auth-gated ise kriter/puan tahmin etme; değerlendirmeyi pending olarak kaydet.","Akran geri bildirimi, P03 öz-kontrolü ve varsa resmî öğretmen geri bildirimini tek puana eritme.","P05 için yalnız bir ürün davranışı seçtir: olay akışı, sahne geçişi, görsel-yazı uyumu, kısa metin açıklığı, dil/yazım veya benzeri gözlenebilir alan.","Hedefi mevcut kanıt → yapılacak değişiklik → beklenen yeni kanıt biçiminde yazdır."],"student_actions":["Geri bildirim kaynaklarını karşılaştırır.","Tek revizyon önceliği seçer.","Hedefini mevcut ürün kanıtıyla gerekçelendirir.","P05'te gözlenecek değişikliği tanımlar."],"activity_ids":["T1_ACT_16_FILM_SERIDI_DEGERLENDIRME"],"form_ids":["FORM_T1_YAZMA_AKRAN","LINK_T1_YAZMA_DPA"],"assessment":"Mevcut kanıt → tek revizyon hedefi → beklenen değişim kaydı. DPA erişilemezse puan üretilmez.","closure":"P05 için tek final revizyon hedefi dondurulur.","materials":["Akran formu","P03 checklist kanıtları","LINK_T1_YAZMA_DPA — resmî EBA bağlantısı"]}
  ],
  "teacher_notes":"EBA DPA bağlantısının varlığı resmîdir; hedef yapısı auth-gated olduğundan kriterleri bu planda modellenmez. Bu fail-closed davranış repo gap kuralıyla uyumludur.",
  "continuation_summary":{"planned_now_hours":2,"remaining_block_hours":2,"covered_outcome_codes":["TDE4.2","TDE4.3","TDE4.4"],"used_activity_ids":["T1_ACT_16_FILM_SERIDI_DEGERLENDIRME"],"next_step_hint":"P05'te tek final revizyonu uygula; sonra T1_ACT_17 tema yansıtması ve T1_ACT_18 tema ölçmeyle Tema 1'i 43/43 kapat."}
}