{"schema_version":"1.0.0","course_id":"TDE_11","theme_id":"TEMA_02","block_id":"BLOCK_T2_01_OKUMA","lesson_hours":2,"plan_title":"KÜLTÜR YOLCULUĞU — Okuma 5: Okumayı Yönetebilme","plan_summary":"15 saatlik okuma bloğunun bu 2 saatlik bölümünde ders kitabındaki doğrulanmış etkinlikler kullanılarak ilgili öğrenme çıktısına yönelik somut öğrenci kanıtı üretilir. Saat içi akış pedagojik öneridir; resmî MEB alt-saat sıralaması olarak sunulmaz.","outcome_codes":["TDE2.3"],"used_activity_ids":["T2_ACT_05_OKUMA_YONETIM"],"used_form_ids":[],"lessons":[{"lesson_no":1,"duration_lesson_hours":1,"title":"Okumayı Yönetebilme: kanıt üretme ve geliştirme","objective":"Öğrenci, “Okumayı Yönetebilme” etkinliğinde okuma amacını ve stratejisini belirler, ön bilgilerini etkinleştirir ve metne ilişkin tahmin geliştirir; ürettiği kanıtı gerekçelendirerek uygulama ve ilk kanıt sürecini tamamlar.","outcome_codes":["TDE2.3"],"opening":"“Okumayı Yönetebilme” görevinin amacı ile beklenen kanıt açıklanır. Öğrenci, bu ders saatinde hangi okuma davranışını göstereceğini ve sonunda hangi somut kanıtı bırakacağını kendi cümlesiyle ifade eder.","teacher_actions":["“Okumayı Yönetebilme” etkinliğinin yönergesini ders kitabındaki doğrulanmış kapsamla uygula; kaynakta bulunmayan içerik veya değerlendirme ölçütü ekleme.","Öğrencinin şu görevi yerine getirmesini sağla: Okuma amacını ve stratejisini belirler, ön bilgilerini etkinleştirir ve metne ilişkin tahmin geliştirir. Kararını veya yorumunu somut metin/performans/ürün göstergesiyle gerekçelendirmesini iste.","“Okuma öncesi cevaplar, tahminler ve hazırlık notları” kanıtını topla. Yalnız katılım gözlemini yeterli sayma; öğrencinin neyi nasıl gösterdiğini kaydet.","Ders sırasında kısa kontrol noktaları kullan; öğrencinin yanlış veya eksik stratejiyi kanıt oluşmadan önce fark edip düzeltmesine fırsat ver."],"student_actions":["Okuma amacını ve stratejisini belirler, ön bilgilerini etkinleştirir ve metne ilişkin tahmin geliştirir.","Kararını, yorumunu veya ürün tercihini somut kaynak göstergesiyle gerekçelendirir.","Ürettiği kanıtı yönergeye göre kontrol eder; eksik veya belirsiz kısmı düzeltir.","Kapanışta bir güçlü kanıtını ve bir geliştirme adımını kısa biçimde kaydeder."],"activity_ids":["T2_ACT_05_OKUMA_YONETIM"],"form_ids":[],"assessment":"Ana ölçme kanıtı “Okuma öncesi cevaplar, tahminler ve hazırlık notları”dir. Geri bildirim, bu kanıtın doğruluğu, gerekçesi ve hedeflenen okuma becerisine uygunluğu üzerinden verilir.","closure":"Öğrenci “Okuma öncesi cevaplar, tahminler ve hazırlık notları” kanıtına bakarak bir güçlü yönünü ve bir sonraki uygulamada yapacağı tek somut değişikliği yazar.","materials":["Metin Tahlili-2 (Anlama): Okuma — Orhun Abideleri / Dîvânu Lugâti’t-Türk — ders kitabı s.114","Öğrencinin bu ders saatinde oluşturduğu somut kanıt kaydı"]},{"lesson_no":2,"duration_lesson_hours":1,"title":"Okumayı Yönetebilme: kanıt üretme ve geliştirme","objective":"Öğrenci, “Okumayı Yönetebilme” etkinliğinde okuma amacını ve stratejisini belirler, ön bilgilerini etkinleştirir ve metne ilişkin tahmin geliştirir; ürettiği kanıtı gerekçelendirerek kanıtı geliştirme ve düzeltme sürecini tamamlar.","outcome_codes":["TDE2.3"],"opening":"“Okumayı Yönetebilme” görevinin amacı ile beklenen kanıt açıklanır. Öğrenci, bu ders saatinde hangi okuma davranışını göstereceğini ve sonunda hangi somut kanıtı bırakacağını kendi cümlesiyle ifade eder.","teacher_actions":["“Okumayı Yönetebilme” etkinliğinin yönergesini ders kitabındaki doğrulanmış kapsamla uygula; kaynakta bulunmayan içerik veya değerlendirme ölçütü ekleme.","Öğrencinin şu görevi yerine getirmesini sağla: Okuma amacını ve stratejisini belirler, ön bilgilerini etkinleştirir ve metne ilişkin tahmin geliştirir. Kararını veya yorumunu somut metin/performans/ürün göstergesiyle gerekçelendirmesini iste.","“Okuma öncesi cevaplar, tahminler ve hazırlık notları” kanıtını topla. Yalnız katılım gözlemini yeterli sayma; öğrencinin neyi nasıl gösterdiğini kaydet.","İlk denemeden sonra ortak bir güçlü örneği ve geliştirilmesi gereken bir örneği anonim biçimde karşılaştır; öğrencinin ikinci denemesinde neyi değiştireceğini netleştir."],"student_actions":["Okuma amacını ve stratejisini belirler, ön bilgilerini etkinleştirir ve metne ilişkin tahmin geliştirir.","Kararını, yorumunu veya ürün tercihini somut kaynak göstergesiyle gerekçelendirir.","Ürettiği kanıtı yönergeye göre kontrol eder; eksik veya belirsiz kısmı düzeltir.","İlk kanıtı ile düzeltilmiş kanıtı karşılaştırıp hangi değişikliğin sonucu iyileştirdiğini açıklar."],"activity_ids":["T2_ACT_05_OKUMA_YONETIM"],"form_ids":[],"assessment":"Ana ölçme kanıtı “Okuma öncesi cevaplar, tahminler ve hazırlık notları”dir. Geri bildirim, bu kanıtın doğruluğu, gerekçesi ve hedeflenen okuma becerisine uygunluğu üzerinden verilir.","closure":"Öğrenci “Okuma öncesi cevaplar, tahminler ve hazırlık notları” kanıtına bakarak bir güçlü yönünü ve bir sonraki uygulamada yapacağı tek somut değişikliği yazar.","materials":["Metin Tahlili-2 (Anlama): Okuma — Orhun Abideleri / Dîvânu Lugâti’t-Türk — ders kitabı s.114","Öğrencinin bu ders saatinde oluşturduğu somut kanıt kaydı"]}],"teacher_notes":"Bu paket yalnız doğrulanmış ders kitabı etkinlik/form kimliklerine ve tanımlı öğrenme çıktılarına dayanır. Dış QR bağlantısındaki doğrulanmamış dereceli puanlama anahtarı ölçüt×düzey içeriği kullanılmaz; pedagojik saat içi sıralama MEB tarafından verilmiş resmî alt-saat sıralaması değildir.","continuation_summary":{"planned_now_hours":2,"remaining_block_hours":5,"covered_outcome_codes":["TDE2.3"],"used_activity_ids":["T2_ACT_05_OKUMA_YONETIM"],"next_step_hint":"Aynı okuma bloğunda kalan 5 saatte kullanılmamış veya derinleştirilecek doğrulanmış kitap etkinlikleriyle beceri kanıtını ilerlet."}}
