{
  "schema_version":"1.0.0","course_id":"TDE_10","theme_id":"TEMA_02","block_id":"BLOCK_T2_01_OKUMA","lesson_hours":2,
  "plan_title":"Kaldırımlar'ı Çözümlemek: Yapı, Üslup, İmge ve Ahenk Birlikteliği",
  "plan_summary":"Tema 2 Okuma bloğunun 11-12. saatlerinde T2_ACT_06_KALDIRIMLAR_TAHLIL sürdürülür. P05'teki imge, ritim, söz varlığı ve duygu kanıtları şiirin yapısal düzeni, üslup tercihleri ve bağlamıyla ilişkilendirilir. Öğrenci bir biçim/üslup özelliğinin şiirin anlam deneyimine katkısını metin kanıtıyla açıklar; saf şiir etiketi hazır özellik listesi olarak ezberletilmez.",
  "outcome_codes":["TDE2.2","TDE2.3"],"used_activity_ids":["T2_ACT_06_KALDIRIMLAR_TAHLIL"],"used_form_ids":[],
  "lessons":[
    {"lesson_no":1,"duration_lesson_hours":1,"title":"Yapısal düzen ile imge ve ritim arasındaki bağ","objective":"Şiirin yapısal düzenini imge, ritim ve duygu akışıyla ilişkilendirmek.","outcome_codes":["TDE2.3"],"opening":"P05'ten iki imge ve iki ritim kanıtı seçilir.","teacher_actions":["Şiirdeki bölüm/geçiş/tekrar düzenlerini metin üzerinde işaretlet.","Yapı → imge/ritim → duygu/anlam zinciri kurdur.","Biçim özelliğini yalnız adlandırmayı yeterli sayma.","Farklı öğrencilerin aynı yapı için farklı işlev yorumlarını kanıt gücüyle karşılaştır."],"student_actions":["Yapısal düzeni işaretler.","İmge ve ritim kanıtlarıyla eşleştirir.","Duygu/anlam katkısını gerekçelendirir.","Bir yorumunu karşı kanıtla sınar."],"activity_ids":["T2_ACT_06_KALDIRIMLAR_TAHLIL"],"form_ids":[],"assessment":"yapı → imge/ritim → duygu/anlam işlevi tablosu.","closure":"Bir yapısal tercihin şiiri nasıl değiştirdiği açıklanır.","materials":["Kaldırımlar metni","P05 kanıt tablosu"]},
    {"lesson_no":2,"duration_lesson_hours":1,"title":"Üslup ve dil tercihlerinin okur etkisi","objective":"Sözcük/cümle/söyleyiş tercihlerini üslup ve okur üzerindeki anlam-duygu etkisiyle ilişkilendirmek.","outcome_codes":["TDE2.3"],"opening":"P05 söz varlığı kayıtlarından örnekler seçilir.","teacher_actions":["Üslubu soyut sıfatlarla değil dil/söyleyiş kanıtlarıyla tanımlat.","Her üslup yargısında en az bir metin örneği iste.","Saf şiir etiketini sonuç olarak kullan; kanıtın yerine koyma.","Kaynak dışı sanatçı biyografisini gerekçe yapma."],"student_actions":["Dil/söyleyiş örneği seçer.","Üslup etkisini açıklar.","Okur/duygu etkisini metinle gerekçelendirir.","Saf şiirle ilişkiyi kanıt sınırında kurar."],"activity_ids":["T2_ACT_06_KALDIRIMLAR_TAHLIL"],"form_ids":[],"assessment":"dil/söyleyiş kanıtı → üslup → okur/anlam etkisi zinciri.","closure":"Öğrenci bir üslup yargısını kanıtıyla savunur.","materials":["Kaldırımlar metni","Üslup-kanıt tablosu"]}
  ],
  "teacher_notes":"Saf şiir özellikleri hazır liste olarak değil Kaldırımlar tahlilindeki kanıtlardan türetilir.",
  "continuation_summary":{"planned_now_hours":2,"remaining_block_hours":3,"covered_outcome_codes":["TDE2.2","TDE2.3"],"used_activity_ids":["T2_ACT_06_KALDIRIMLAR_TAHLIL"],"next_step_hint":"P07'de T2_ACT_07 ile Gazel ve Kaldırımlar'ı aynı karşılaştırma matrisi üzerinde incele."}
}